Retrieved_true,Questions,paraphrases,eg_ar_question (GPT3.5 Turbo),eg_ar_question_edited ,edited_answer (GPT3.5 Turbo),,
"كذلك لافتة (المصعد معطل) لا تعرف استثناء، فهي ترهق الجميع خصوصا إذا كانت تتعاون مع سلم البناء بدرجاته الراسخة التي يصعب تجاوزها بمرور الأيام، وقد بدأت الصعود بخطوات تبدو سريعة حتى تحولت إلى خطوات ثقيلة وهزيلة ومشتتة، فما لبثت أستعين بأحد الحوائط؛ استجابة لصرخات أنفاسي التي نعتني بأقسي الأوصاف بسبب خطواتي المتثاقلة. فارتكزت إلى الحائط لأجد خلفي أحد أبناء جيراننا المزعجين يتساءل. لماذا أقف هكذا؟ شردت حينها إلى ذكريات فناء منزلنا القديم عندما سألت جدي إبراهيم عن سبب توقفه الدائم والمتكرر أثناء صعوده، فالتفت إلي حينها، وهو متشبث بعكازه وبصوت محشرج قال عندما تكون في مثل عمري ستعرف. لم أجد أعظم من إجابة جدي إبراهيم لأجيبه بها.",ما الذي شرد الكاتب إلى ذكريات فناء منزلهم القديم؟,What made the writer reminisce about the old house they used to live in?, ايه اللي خلّى الكاتب يفكر في ذكريات فناء بيتهم القديم؟, ايه اللي خلّى الكاتب يفكر في ذكريات فناء بيتهم القديم؟,الكاتب شرد إلى ذكريات فناء منزلهم القديم عندما سأل أحد أبناء جيرانه عن سبب توقفه أثناء صعوده وتذكر إجابة جده إبراهيم عندما كان في نفس عمره.,,
"ولكن كيف سيستجيب النظام البيئي للبحيرات مع ارتفاع درجات الحرارة على الأرض؟ فالبحيرات تشكل 3% فقط من مساحة كوكب الأرض، ولكنها تحتجز كميات من الكربون تفوق ما تحتجزه المحيطات جميعها؛ فهل ستقوم البحيرات بإطلاق كميات أكبر من غازي ثاني أكسيد الكربون والميثان فترتفع درجة حرارتها؟ ما يمثل تهديدات للنظام البيئي للمسطحات المائية العذبة نتيجة الاحترار العالمي، هذا ما يزيد الضغط على النظام البيئي للبحيرات الذي يعاني بالفعل من أثر الأنواع المائية الغازية، والتغيرات الضارة في استخدام الأراضي، ومصادر التلوث غير المحددة، والتلوث الكيميائي السام، وتشمل التأثيرات المحتملة للاحتباس الحراري قلة مستويات المياه؛ نظرا لأن الغطاء الثلجي المتناقص سيؤدي إلى زيادة نسبة البخر وكذلك زيادة درجة حرارة المياه.",ما نسبة مساحة البحيرات من كوكب الأرض؟,What is the percentage of the Earth's surface area covered by lakes?, ايه نسبة مساحة البحيرات فى كوكب الأرض؟, ايه نسبة مساحة البحيرات على كوكب الأرض؟,3%,,
"من الآثار السلبية المباشرة لحرائق الغابات القضاء على مساحات واسعة من الغطاء النباتي، مثل الغابات المطيرة التي تستغرق وقتاً طويلاً لتعود إلى طبيعتها، وتتسبب الحرائق أيضاً في نفوق آلاف الحيوانات، وينجو بعضها بالاختباء تحت الأرض أو الهروب إلى مناطق آمنة، وكذلك ينتج عن حرائق الغابات دخان كثيف يؤثر في نقاء الهواء ويضر برئتي الإنسان، فضلاً عن انبعاث كميات هائلة من الميثان وثاني أكسيد الكربون؛ فتزداد درجات حرارة المناخ، وتتأثر مصادر المياه وجودتها ما يؤدي إلى تدمير مواطن الحيوانات.",كيف تؤثر الغازات المنبعثة من حرائق الغابات على المناخ؟,How do gases emitted from forest fires affect the climate?,إزاي الغازات اللي بتنبعث من حرائق الغابات بتأثر على الجو؟,إزاي الغازات اللي بتنبعث من حرايق الغابات بتأثر على الجو؟,"تزيد الغازات المنبعثة من حرائق الغابات مثل الميثان وثاني أكسيد الكربون من درجات حرارة المناخ، مما يساهم في زيادة ظاهرة الاحتباس الحراري وتغير المناخ.",,
"بدأت في مراقبة الشجرة التي أمام فناء منزلي كأنني أراها للمرة الأولى: فنظرتنا إلى الأشياء تختلف بمرور العمر، لا شيء يتبقى منها إلا خدوش الروح وندبات القلب. في بلوغ الخامسة والخمسين ما كنت ألاحظ تساقط الأوراق التي كانت منذ أيام شديدة النضارة لا يشوبها شيء، لونها أخضر لامع يظهر بقوة مفرطة. لا شيء إلا أيام وتتساقط تلك الأوراق تساقط استسلام ورضوخ للأيام، ما عاد ماء ينفع أو غصن يتمسك بها، فالأيام صبغتها بألوان أخرى، وليس أمامها إلا السقوط كسائر الأشياء. فدورة الأيام لا تعرف الاستثناء.",في أي سن بدأ الكاتب في مراقبة الشجرة كأنه يراها للمرة الأولى؟,At what age did the writer begin to observe the tree as if seeing it for the first time?, ازاي الكاتب ابتدى يتفرج على الشجرة زي ما هو شايفها لأول مرة؟,الكاتب ابتدا في مراقبة الشجرة كأنه بيشوفها لاول مره وهو عنده كام سنه؟,بدأ الكاتب في مراقبة الشجرة كأنه يراها للمرة الأولى في بلوغه الخامسة والخمسين.,,
"تتجمد نحو خمسين مليون بحيرة موسميا، وكان من المعتقد أن الحياة تحت سطوحها الجليدية تتوقف في فصل الشتاء، إلا أن الدراسات التي تجرى على البحار المتجمدة أثبتت أنه على عكس الاعتقادات الماضية، فإن الحياة تحت الثلج مزدهرة ونشطة للغاية، وقد أجريت بعض الدراسات السابقة على حالة البحيرات في الصيف، ولكننا لم نعلم إلا قليلا عما يحدث تحت الغطاء الثلجي في فصل الشتاء، من هنا بدأت (ستيفاني هامبتون) مديرة مركز البحوث البيئية في (جامعة واشنطن) تجميع البيانات الخاصة بحالة البحيرات في الشتاء وتحليلها، وذلك من أجل مقارنتها بحالتها في الصيف.",ما هي أهمية الدراسات التي تجرى على البحار المتجمدة؟,What is the significance of studies conducted on frozen seas?, ايه اهمية الدراسات اللي بتتعمل على البحار المتجمدة؟, ايه اهمية الدراسات اللي بتتعمل على البحار المتجمدة؟,"أهمية الدراسات التي تجرى على البحار المتجمدة هي كشف الحياة النشطة والمزدهرة تحت الثلج في فصل الشتاء، والتي تعارض الاعتقادات السابقة التي كانت تشير إلى توقف الحياة في هذه الظروف. كما تساهم هذه الدراسات في فهم البيئة البحرية وتأثير التغيرات المناخية على الحياة البحرية.",,
"حرانق الغابات حرانق هائلة يصعب السيطرة عليها بسهولة، وتندلع في الغابات والأراضي ذات الغطاء النباتي، وقد شهدت الأعوام الأخيرة زيادة في حدتها، ففي عام ٢٠٢١ التهمت النيران ما يقرب من ثمانية ملايين فدان في الولايات المتحدة الأمريكية وحدها. وبالرغم من أن هذه المساحة أقل مما التهمته النيران في عام ٢٠٢٠ والذي تقدر مساحته بما يقارب اثني عشر مليون فدان، فقد زادت صعوبة مكافحة الحرائق عن ذي قبل لسرعة انتشارها.",ما هو الفرق بين حرائق عام ٢٠٢٠ وحرائق عام ٢٠٢١؟,What is the difference between the fires of 2020 and the fires of 2021?, ايه الفرق بين الحرايق في سنة ٢٠٢٠ والحرايق في سنة ٢٠٢١؟, ايه الفرق بين الحرايق في سنة ٢٠٢٠ والحرايق في سنة ٢٠٢١؟,"الفرق بين حرائق عام ٢٠٢٠ وحرائق عام ٢٠٢١ هو أن في عام ٢٠٢١ التهمت النيران ما يقرب من ثمانية ملايين فدان في الولايات المتحدة الأمريكية، بينما في عام ٢٠٢٠ تهمت النيران ما يقارب اثني عشر مليون فدان.",,
"ورغم ذلك، فلحرائق الغابات آثار حميدة تعود بالنفع على توازن النظام البيئي: إذ تقضي على الحشائش والشجيرات، والأشجار الضعيفة والأوراق الجافة، وبقايا الكائنات الحية التي تعد وقوداً للحرائق الهائلة، ويترتب على ذلك أمور عدة منها: حصول الأشجار القوية على مزيد من ضوء الشمس، ونمو نباتات جديدة، كما يمكن لبعض الكائنات التي تعيش في التربة الحصول على المواد الغذائية، كذلك تزداد خصوبة التربة بسبب تشرب المواد الغذائية الناشئة عن احتراق المواد العضوية، كما لا تنمو بذور بعض النباتات إلا بوجود الحرائق.",ما هي الفوائد البيئية لحرائق الغابات بالنسبة للنباتات الجديدة؟,What are the environmental benefits of forest fires for new plants?, ايه الفوايد البيئية لحرايق الغابات على النباتات الجديدة؟, ايه الفوايد البيئية لحرايق الغابات على النباتات الجديدة؟,"الفوائد البيئية لحرائق الغابات بالنسبة للنباتات الجديدة تشمل حصول الأشجار القوية على مزيد من ضوء الشمس، ونمو نباتات جديدة، وزيادة خصوبة التربة بسبب تشرب المواد الغذائية الناشئة عن احتراق المواد العضوية، وزيادة نمو بذور بعض النباتات التي لا تنمو إلا بوجود الحرائق.",,
"الشمش أو الصواعق الرعدية أو أعواد الثقاب المشتعلة، وأما الوقود فمصدره الأشجار والأوراق الجافة والحشائش. وأما الأكسجين فيعمل على بقاء النار مشتعلة، وتنقل الرياح ألسنة اللهب إلى مناطق مختلفة. توجد أسباب طبيعية تساعد على حدوث حرائق الغابات، منها: الجفاف، وارتفاع درجات الحرارة، والصواعق الرعدية، والحمم البركانية، ولكن تشير الإحصاءات إلى أن الإنسان هو السبب الرئيس وراء اندلاعها؛ فوفقاً لوزارة الداخلية الأمريكية كان 90% من حرائق الغابات بفعل العامل البشري، ويمكن أن يكون لسلوك الإنسان آثار تدميرية إذا قل حرصه في أثناء حرق النفايات، أو إشعال النيران في معسكرات التخييم، أو استخدام الألعاب النارية بالقرب من الغابات والمناطق الخضراء، بالإضافة إلى حوادث السيارات والأعمال التخريبية مثل حرق الأشجار والمنشآت.",ما هي بعض مصادر الوقود التي تساعد على نشوب حرائق الغابات؟,What are some sources of fuel that contribute to forest fires?, ايه هي المصادر اللي بتساعد على اندلاع حرائق الغابات؟, ايه مصادر الوقود اللي بتساعد على وقوع حرايق الغابات؟,"بعض مصادر الوقود التي تساعد على نشوب حرائق الغابات هي الأشجار، الأوراق الجافة، والحشائش.",,
"حرانق الغابات حرانق هائلة يصعب السيطرة عليها بسهولة، وتندلع في الغابات والأراضي ذات الغطاء النباتي، وقد شهدت الأعوام الأخيرة زيادة في حدتها، ففي عام ٢٠٢١ التهمت النيران ما يقرب من ثمانية ملايين فدان في الولايات المتحدة الأمريكية وحدها. وبالرغم من أن هذه المساحة أقل مما التهمته النيران في عام ٢٠٢٠ والذي تقدر مساحته بما يقارب اثني عشر مليون فدان، فقد زادت صعوبة مكافحة الحرائق عن ذي قبل لسرعة انتشارها.",ما هي حرانق الغابات؟,What are forest fires?, ايه هي حرانق الغابات؟, ايه هي حرايق الغابات؟,حرائق الغابات هي حرائق كبيرة تندلع في الغابات والأراضي ذات الغطاء النباتي وتكون صعبة السيطرة عليها.,,
"ويتوقف نجاح عمليات معالجة وإعادة استخدام مياه الصرف الصناعي على مجموعة من المعايير والضوابط البيئية التي ترتبط بطبيعة هذه المياه، والهدف النهائي من معالجتها وإعادة استخدامها، والذي يجب أن يجرى في إطار يكفل حماية البيئة والأفراد مع الأخذ في الاعتبار الاعتبارات الاقتصادية وضرورة متابعة الآثار البيئية لإعادة استخدام هذه المياه على مكونات المنظومة البيئية، وذلك من خلال وضع برامج متكاملة للرصد البيئي للملوثات وآثارها على البيئة المحيطة.",ما هي أهمية وضع برامج متكاملة للرصد البيئي للملوثات؟,What is the significance of implementing integrated environmental monitoring programs for pollutants?, ايه اهمية وضع برامج متكاملة لرصد البيئة والملوثات؟, ايه اهمية وضع برامج متكاملة لمتابعه الملوثات؟,"أهمية وضع برامج متكاملة للرصد البيئي للملوثات تكمن في ضمان حماية البيئة والأفراد من آثار الملوثات، وفي متابعة الآثار البيئية لإعادة استخدام مياه الصرف الصناعي على مكونات المنظومة البيئية. تساعد هذه البرامج في تقييم مدى تأثير الملوثات على البيئة وتحديد الإجراءات الواجب اتخاذها للحد من هذا التأثير وضمان استدامة عمليات معالجة وإعادة استخدام المياه الصناعية.",,
"تتخذ البومة شعارًا للحكمة وبعد النظر؛ تراها مرسومة على الكتب أحيانًا ليدل الناشر على ما تحويه كتبه من حكمة خالدة؛ شهد لها الناس منذ الأزل بصدق النظر. وحدث أني كنت أقرأ كتابًا، وكانت البومة على غلافه شعارًا للناشر، فسألت نفسي: لماذا اتخذ هذا الطائر المشئوم رمزًا للحكمة؟ أيكون ذلك للعينين المفتوحتين اللتين لا ينسدل عليهما الجفنان في ظلمة المساء؟ أتكون العينان المفتوحتان قد أغرتا الرامزين أن يتخذوا من دوام الإبصار دليلًا على سداد البصيرة وبعد النظر؟ أم يكون ذلك لما تعانيه البومة في الليل من سهر حين يكون الخليون في مخادعهم نومًا غافلين عن الطبيعة بكل ما فيها من جلال وجمال؟ أم تكون الجلسة الساكنة الهادئة الرزينة هي التي أغرت الرامزين أن يشيروا بها إلى التأمل العميق فاتخذوا البومة شعارًا لهذا كله؟",ما هي بعض الأسباب التي اقترحها الكاتب لتفسير اتخاذ البومة رمزًا للحكمة؟,What are some of the reasons suggested by the author to explain why the owl was chosen as a symbol of wisdom?, ايه الأسباب اللي الكاتب اقترحها لتفسير اختيار البومة تمثيل للحكمة؟, ايه الأسباب اللي الكاتب اقترحها لتفسير اختيار البومة كرمز للحكمة؟,"الكاتب اقترح عدة أسباب لتفسير اتخاذ البومة رمزًا للحكمة، منها:
1. قدرة البومة على النظر بوضوح في الظلمة، مما يرمز إلى البصيرة والحكمة.
2. سهر البومة في الليل وعدم نومها، مما يرمز إلى التفكير العميق والتأمل.
3. الهدوء والسكينة التي تتمتع بها البومة، مما يرمز إلى التأمل والتفكير العميق.",,
"ولكن كيف سيستجيب النظام البيئي للبحيرات مع ارتفاع درجات الحرارة على الأرض؟ فالبحيرات تشكل 3% فقط من مساحة كوكب الأرض، ولكنها تحتجز كميات من الكربون تفوق ما تحتجزه المحيطات جميعها؛ فهل ستقوم البحيرات بإطلاق كميات أكبر من غازي ثاني أكسيد الكربون والميثان فترتفع درجة حرارتها؟ ما يمثل تهديدات للنظام البيئي للمسطحات المائية العذبة نتيجة الاحترار العالمي، هذا ما يزيد الضغط على النظام البيئي للبحيرات الذي يعاني بالفعل من أثر الأنواع المائية الغازية، والتغيرات الضارة في استخدام الأراضي، ومصادر التلوث غير المحددة، والتلوث الكيميائي السام، وتشمل التأثيرات المحتملة للاحتباس الحراري قلة مستويات المياه؛ نظرا لأن الغطاء الثلجي المتناقص سيؤدي إلى زيادة نسبة البخر وكذلك زيادة درجة حرارة المياه.",كيف يؤثر الغطاء الثلجي المتناقص على مستويات المياه في البحيرات؟,How does the decreasing snow cover affect water levels in lakes?,ازاي الثلج اللي بيتقلص بيؤثر على مستويات المياه في البحيرات؟,ازاي الغطاء الثلجي اللي بينقص بياثر على مستويات المية في البحيرات؟,"الغطاء الثلجي المتناقص يؤدي إلى زيادة نسبة البخر وزيادة درجة حرارة المياه، مما يسبب قلة في مستويات المياه في البحيرات.",,
"من باب الصمت أن تختار لجلوسك مكانا مستورا تخلو فيه إلى نفسك، أو إلى من تتحدث إليه من الأصدقاء فيكون لك بهذا التخفى وجود واضح بارز ومن باب الجلبة والصياح أن تجلس مكشوفا على طوار الشارع فى المقهى، حيث تصبح جزءا من بضائع الدكاكين وحركة المرور، ومن الصمت أن تختار لملابسك وأثاث منزلك ألوانا خافتة هادئة يرتاح إليها البصر، كما أن من الجلبة والصياح أن تختار هذه الأشياء من ذوات الألوان الزاعقة التى تلفت الأنظار، ومن الصمت أن تعلن عن عيادتك، أو مكتبك، أو دكانك بلافتة صغيرة متواضعة، كما أن من الجلبة والصياح أن تعلن عن نفسك بلافتة عريضة تسد على الناس مسالك الطريق، واذكر أن ارتفاع الصوت قد يدل على تفاهة الصائت فالكلب الذى ينبح لا يعض وكلما ازدادت الشاة صياحا قل على ظهرها الصوف، والضفدعة الهزيلة الضئيلة تملأ الآفاق ضجة ونقيقا. يستحيل أن تكون من الصاخبين ومن العاملين فى وقت واحد، ويستحيل أن تكون من الصائحين ومن الفكرين فى وقت واحد، فقد يتعذر أن يجتمع الكلام والعمل لأن الفكرة إذا طافت برأسك فصحت بها كلاما انتهى بذلك أمرها؛ أما إذا حبستها فى نفسك، وأغلقت دونها صدرك بمغاليق الصمت، فقد تتفجر فى صورة عمل عاجلا أو آجلا.",لماذا يستحيل أن تكون من الصاخبين ومن العاملين في وقت واحد؟,Why is it impossible to be both noisy and productive at the same time?, ليه مش ممكن تكون صاخب وشغال في نفس الوقت؟, ليه مش ممكن تكون بتعمل دوشه وبتشتغل في نفس الوقت؟,"يستحيل أن تكون من الصاخبين ومن العاملين في وقت واحد لأن الصاخبين يكونون عادةً متميزين بالصخب والضجيج والاهتمام بالظهور الخارجي وجذب الانتباه، بينما العاملين يكونون متميزين بالتركيز والاجتهاد في العمل والتفكير العميق. الصاخبين يميلون إلى الظهور الخارجي والتأثير على الآخرين بشكل سطحي، بينما العاملين يميلون إلى التركيز على العمل وتحقيق النجاح بشكل داخلي.",,
"لكن يقطع حديثي مع ذلك المزعج صوت رقيق عذب يحمل في صوته أياماً لم تنفد وأملاً لا ينقطع وشغفاً مستمراً. فاتجهت بأنظاري إلى مصدر ذلك الصوت الذي اقتربت صاحبته فإذا هي إحدى جيراننا الأعزاء والتي هاجرت منذ دهر، لكن ملامحها لم تتغير كأنها لم يمر بها العمر، بل ما زالت تحتفظ برونقها وسماء وجهها الصافي الذي لا يحمل أي غيوم، فاتسعت حدقة عيني وتخشبت ملامحي وهربت كلماتي، حتى ابتلعت ريقي وأغمضت عيني لحظات ثم صحت بصوت يملؤه الاندهاش: يسرية؟! فأجابت بهدوء: لا، أنا ابنتها ليلى. حينها أدركت أنه ما عاد ماء ينفع أو غصن يتمسك بنا. فحاولت تجاوز الأمر بحديث لم يتجاوز كثيراً ثرثرة رجل تخطى الخمسين، واستأنفت طريقي إلى منزل زوجتي الذي أصبح يمتلئ بذكرياتنا الدافئة ويعوضني عن درجات السلم وبداية أيام خريف العمر.",كيف أجابت صاحبة الصوت العذب على الكاتب؟,Paraphrased question: كيف ردت صاحبة الصوت الجميل على الكاتب؟, ازاي صاحبة الصوت العذب ردت على الكاتب؟, ازاي صاحبة الصوت العذب ردت على الكاتب؟,"أجابت صاحبة الصوت العذب بأنها ابنة يسرية، ليس يسرية نفسها.",,
