Retrieved_true,Questions,paraphrases,eg_ar_question (GPT3.5 Turbo),eg_ar_question_edited ,edited_answer (GPT3.5 Turbo),,
"لذا فإن الحاجة ماسة لترشيد الاستخدام المتاح من هذه الموارد المائية وبشكل خاص في الدول العربية، والتي تعاني شحاً وندرة في الموارد المائية المتاحة بها؛ نظراً لأن معظم أراضيها في نطاق المناطق القاحلة وشبه القاحلة التي تتسم بانخفاض الأمطار، ومن هنا تنامت أهمية معالجة وإعادة استخدام مياه الصرف الصحي والصناعي، فاتجهت معظم دول العالم إلى التخطيط والإدارة السليمة المتكاملة لإعادة استخدام مياه الصرف بعد معالجتها بكفاءة، وتخلصت من الأسلوب القديم الذي كان متبعاً في الماضي عن طريق صرفها في المسطحات المائية، وتطورت تقنيات وأساليب المعالجة بشكل متسارع، وخاصة في السنوات الأخيرة.",لماذا تتسم أراضي الدول العربية بشح الموارد المائية؟,,ليه بتكون أراضي الدول العربية فيها نقص في الموارد المائية؟,هو ليه في نقص في الموارد المائية في  أراضي الدول العربية؟,تتسم أراضي الدول العربية بشح الموارد المائية نظراً لأن معظم أراضيها في نطاق المناطق القاحلة وشبه القاحلة التي تتسم بانخفاض الأمطار.,,
"لاحظ العلماء - منذ زمن - أن ارتفاع درجة الحرارة الصغرى ليلاً سببه كثافة الغيوم بالسماء؛ لأنها تحتفظ تحتها بالحرارة المنبعثة من سطح الأرض. ولا تسربها للأجواء العليا أو الفضاء. وهذا ما يطلق عليه ظاهرة الاحتباس الحراري أو ما يقال بالدفيئة للأرض أو ظاهرة البيوت الزجاجية: مما يجعل حرارة النهار أبرد لأن هذه السحب تعكس ضوء الشمس بكميات كبيرة ولا تجعله ينفذ منها للأرض كأنها حجب للشمس أو ستر لحرارتها، كما نجد أن التربة تزداد رطوبة في الأيام المطيرة،     ورغم كثرة الغيوم وكثافتها بالسماء إلا أن درجة الحرارة لا ترتفع لأن طاقة أشعة الشمس تُستنفد في عملية التبخير والتجفيف للتربة.",ماذا يلاحظ العلماء عن ارتفاع درجة الحرارة الصغرى ليلاً؟,, ايه اللى العلماء بيلاحظوه لما درجة الحرارة الصغرى بتزيد ليلا؟,هو ايه اللى العلماء لاحظوه عن ارتفاع درجة الحرارة الصغرى بليل؟,يلاحظ العلماء أن ارتفاع درجة الحرارة الصغرى ليلاً سببه كثافة الغيوم بالسماء؛ لأنها تحتفظ تحتها بالحرارة المنبعثة من سطح الأرض.,,
"من باب الصمت أن تختار لجلوسك مكانا مستورا تخلو فيه إلى نفسك، أو إلى من تتحدث إليه من الأصدقاء فيكون لك بهذا التخفى وجود واضح بارز ومن باب الجلبة والصياح أن تجلس مكشوفا على طوار الشارع فى المقهى، حيث تصبح جزءا من بضائع الدكاكين وحركة المرور، ومن الصمت أن تختار لملابسك وأثاث منزلك ألوانا خافتة هادئة يرتاح إليها البصر، كما أن من الجلبة والصياح أن تختار هذه الأشياء من ذوات الألوان الزاعقة التى تلفت الأنظار، ومن الصمت أن تعلن عن عيادتك، أو مكتبك، أو دكانك بلافتة صغيرة متواضعة، كما أن من الجلبة والصياح أن تعلن عن نفسك بلافتة عريضة تسد على الناس مسالك الطريق، واذكر أن ارتفاع الصوت قد يدل على تفاهة الصائت فالكلب الذى ينبح لا يعض وكلما ازدادت الشاة صياحا قل على ظهرها الصوف، والضفدعة الهزيلة الضئيلة تملأ الآفاق ضجة ونقيقا. يستحيل أن تكون من الصاخبين ومن العاملين فى وقت واحد، ويستحيل أن تكون من الصائحين ومن الفكرين فى وقت واحد، فقد يتعذر أن يجتمع الكلام والعمل لأن الفكرة إذا طافت برأسك فصحت بها كلاما انتهى بذلك أمرها؛ أما إذا حبستها فى نفسك، وأغلقت دونها صدرك بمغاليق الصمت، فقد تتفجر فى صورة عمل عاجلا أو آجلا.",كيف تعلن عن عيادتك أو مكتبك أو دكانك بطريقة تعبر عن الصمت؟,, ازاي تعلن عن عيادتك أو مكتبك أو دكانك بطريقة تعبر عن الهدوء؟, ازاي تعلن عن عيادتك أو مكتبك أو دكانك بطريقة تعبر عن الهدوء؟,يمكن الإعلان عن عيادتك أو مكتبك أو دكانك بطريقة تعبر عن الصمت عن طريق وضع لافتة صغيرة ومتواضعة تحمل اسمك أو اسم العيادة أو المكتب أو الدكان بدون الحاجة إلى الكثير من الألوان الزاهية أو التصاميم البارزة. يمكن أن تكون اللافتة بسيطة وهادئة لتناسب الصمت والهدوء الذي ترغب في توجيهه لعملك.,,
"قبل قيام الثورة الصناعية كان تركيز ثانى أكسيد الكربون ٨٠؟ جزةا فى المليون، رغم ضالة هذه النسية إلا أن غاز ثاي أكسيد الكريون قد لعب دورا هاما فى الحفاظ علي درجة حرارة الأرض دافنة ومناسية للحياة، ويعود ذلك إلى قدرة جرى» ثاى أكسيد الكربون على حبس الطاقة الحرارية المنعكسة من سطح الأرض، ومن ثم بدلا من ارتداد هذه الطاقة الحرارية إلى الفضاء الخارجى فإن هذا الغازيقوم بحفلها قريبة من سطح الأرص. مع بد» الثورة الصناعية بدأ الإنسان باستخدام الوقود الأحفورى (نفط - غاز - فحم) بكميات كبيرة ومترايدة، وفى خمسينيات القرن الماضى ارتفع تركيز ثانى أكسيد الكربون فى الغلاف الجوى إلى ٣١٥ جزءا في المليون، وقد أدث هذه الزيادة بالفعل إلى ازدياد فى درجة حرارة الأرض.",ماذا حدث لتركيز ثاني أكسيد الكربون بعد بدء الثورة الصناعية؟,, ايه اللي حصل لتركيز غاز ثاني أكسيد الكربون بعد بداية الثورة الصناعية؟, ايه اللي حصل لتركيز غاز ثاني أكسيد الكربون بعد بداية الثورة الصناعية؟,ارتفع تركيز ثاني أكسيد الكربون في الغلاف الجوي إلى ٣١٥ جزءا في المليون بعد بدء الثورة الصناعية.,,
"الشمش أو الصواعق الرعدية أو أعواد الثقاب المشتعلة، وأما الوقود فمصدره الأشجار والأوراق الجافة والحشائش. وأما الأكسجين فيعمل على بقاء النار مشتعلة، وتنقل الرياح ألسنة اللهب إلى مناطق مختلفة. توجد أسباب طبيعية تساعد على حدوث حرائق الغابات، منها: الجفاف، وارتفاع درجات الحرارة، والصواعق الرعدية، والحمم البركانية، ولكن تشير الإحصاءات إلى أن الإنسان هو السبب الرئيس وراء اندلاعها؛ فوفقاً لوزارة الداخلية الأمريكية كان 90% من حرائق الغابات بفعل العامل البشري، ويمكن أن يكون لسلوك الإنسان آثار تدميرية إذا قل حرصه في أثناء حرق النفايات، أو إشعال النيران في معسكرات التخييم، أو استخدام الألعاب النارية بالقرب من الغابات والمناطق الخضراء، بالإضافة إلى حوادث السيارات والأعمال التخريبية مثل حرق الأشجار والمنشآت.",ما هي بعض الأنشطة البشرية التي تسهم في نشوب حرائق الغابات؟,, ايه الأنشطة البشرية اللي بتساهم في نشوب حرائق الغابات؟, ايه الأنشطة البشرية اللي بتساهم في نشوب حرايق الغابات؟,"بعض الأنشطة البشرية التي تسهم في نشوب حرائق الغابات هي:
1. حرق النفايات بدون احترازات كافية.
2. إشعال النيران في معسكرات التخييم دون اتباع الإجراءات الأمنية.
3. استخدام الألعاب النارية بالقرب من الغابات والمناطق الخضراء.
4. حوادث السيارات التي يمكن أن تتسبب في اندلاع الحرائق.
5. الأعمال التخريبية مثل حرق الأشجار والمنشآت.",,
"لاحظ العلماء - منذ زمن - أن ارتفاع درجة الحرارة الصغرى ليلاً سببه كثافة الغيوم بالسماء؛ لأنها تحتفظ تحتها بالحرارة المنبعثة من سطح الأرض. ولا تسربها للأجواء العليا أو الفضاء. وهذا ما يطلق عليه ظاهرة الاحتباس الحراري أو ما يقال بالدفيئة للأرض أو ظاهرة البيوت الزجاجية: مما يجعل حرارة النهار أبرد لأن هذه السحب تعكس ضوء الشمس بكميات كبيرة ولا تجعله ينفذ منها للأرض كأنها حجب للشمس أو ستر لحرارتها، كما نجد أن التربة تزداد رطوبة في الأيام المطيرة،     ورغم كثرة الغيوم وكثافتها بالسماء إلا أن درجة الحرارة لا ترتفع لأن طاقة أشعة الشمس تُستنفد في عملية التبخير والتجفيف للتربة.",ماذا يحدث للتربة في الأيام المطيرة؟,, ايه اللي بيحصل للتربة في الأيام اللي فيها مطر؟, ايه اللي بيحصل للتربة في الأيام اللي فيها مطر؟,تزداد رطوبة التربة في الأيام المطيرة.,,
"ويتوقف نجاح عمليات معالجة وإعادة استخدام مياه الصرف الصناعي على مجموعة من المعايير والضوابط البيئية التي ترتبط بطبيعة هذه المياه، والهدف النهائي من معالجتها وإعادة استخدامها، والذي يجب أن يجرى في إطار يكفل حماية البيئة والأفراد مع الأخذ في الاعتبار الاعتبارات الاقتصادية وضرورة متابعة الآثار البيئية لإعادة استخدام هذه المياه على مكونات المنظومة البيئية، وذلك من خلال وضع برامج متكاملة للرصد البيئي للملوثات وآثارها على البيئة المحيطة.",ما هو الإطار الذي يجب أن تجرى فيه عمليات معالجة وإعادة استخدام مياه الصرف الصناعي؟,, ايه هو النظام اللي لازم تتم فيه عمليات معالجة واعادة استخدام مياه الصرف الصناعي؟, هو ايه النظام اللي لازم يتعمل بالنسبه لعمليات معالجة واعادة استخدام مية الصرف الصناعي؟,"يجب أن تجرى عمليات معالجة وإعادة استخدام مياه الصرف الصناعي في إطار يكفل حماية البيئة والأفراد، مع مراعاة الاعتبارات الاقتصادية وضرورة متابعة الآثار البيئية لإعادة استخدام هذه المياه على مكونات المنظومة البيئية.",,
"تتجمد نحو خمسين مليون بحيرة موسميا، وكان من المعتقد أن الحياة تحت سطوحها الجليدية تتوقف في فصل الشتاء، إلا أن الدراسات التي تجرى على البحار المتجمدة أثبتت أنه على عكس الاعتقادات الماضية، فإن الحياة تحت الثلج مزدهرة ونشطة للغاية، وقد أجريت بعض الدراسات السابقة على حالة البحيرات في الصيف، ولكننا لم نعلم إلا قليلا عما يحدث تحت الغطاء الثلجي في فصل الشتاء، من هنا بدأت (ستيفاني هامبتون) مديرة مركز البحوث البيئية في (جامعة واشنطن) تجميع البيانات الخاصة بحالة البحيرات في الشتاء وتحليلها، وذلك من أجل مقارنتها بحالتها في الصيف.",على ماذا أجريت بعض الدراسات السابقة المتعلقة بالبحيرات؟,Paraphrased question: ما هو موضوع بعض الدراسات السابقة التي أُجريت حول البحيرات؟, اتعملت ايه في بعض الدراسات اللي اتعملت قبل كده عن البحيرات؟,هي ايه الدراسات اللي اتعملت قبل كده عن البحيرات؟,أجريت بعض الدراسات السابقة على حالة البحيرات في الصيف.,,
"ويختلف تصميم محطات المعالجة طبقا لنوعية وخصائص مياه الصرف التي ستقوم المحطة بمعالجتها، وتركيز الملوثات التي تختلف من صناعة إلى أخرى، ومن منشأة إلى أخرى ضمن نفس الصناعة، ومن وقت إلى آخر ضمن المصنع الواحد، ولقد كان هذا الاختلاف تحدياً لمهندسي ومطوري تقنيات معالجة المياه؛ ليعتمدوا طرق وتقنيات نوعية المعالجة لمياه الصرف الصناعي، واعتماد هذه الطرق كجزء من الإدارة البيئية داخل المنشآت الصناعية، بالإضافة إلى ضرورة اختيار أنسب الطرق لإدارتها.",لماذا يجب اعتماد طرق وتقنيات نوعية لمعالجة مياه الصرف الصناعي؟,Why is it necessary to adopt quality methods and techniques for treating industrial wastewater?,ليه لازم نعتمد طرق وتقنيات نوعية عشان نعالج مياه الصرف الصناعي؟,ليه لازم نعتمد طرق وتقنيات نوعية عشان نعالج مية الصرف الصناعي؟,يجب اعتماد طرق وتقنيات نوعية لمعالجة مياه الصرف الصناعي لأن تصميم محطات المعالجة يختلف وفقا لنوعية وخصائص المياه وتركيز الملوثات التي تختلف من صناعة إلى أخرى. يجب اختيار الأساليب الأنسب لإدارة ومعالجة هذه المياه بشكل فعال وفعال من الناحية البيئية داخل المنشآت الصناعية.,,
"لذا فإن الحاجة ماسة لترشيد الاستخدام المتاح من هذه الموارد المائية وبشكل خاص في الدول العربية، والتي تعاني شحاً وندرة في الموارد المائية المتاحة بها؛ نظراً لأن معظم أراضيها في نطاق المناطق القاحلة وشبه القاحلة التي تتسم بانخفاض الأمطار، ومن هنا تنامت أهمية معالجة وإعادة استخدام مياه الصرف الصحي والصناعي، فاتجهت معظم دول العالم إلى التخطيط والإدارة السليمة المتكاملة لإعادة استخدام مياه الصرف بعد معالجتها بكفاءة، وتخلصت من الأسلوب القديم الذي كان متبعاً في الماضي عن طريق صرفها في المسطحات المائية، وتطورت تقنيات وأساليب المعالجة بشكل متسارع، وخاصة في السنوات الأخيرة.",كيف يمكن للدول العربية مواجهة شح الموارد المائية؟,How can Arab countries confront the scarcity of water resources?, ازاي الدول العربية تقدر تواجه نقص الموارد المائية؟, ازاي الدول العربية تقدر تواجه نقص الموارد المائية؟,"يمكن للدول العربية مواجهة شح الموارد المائية من خلال ترشيد الاستخدام المتاح من هذه الموارد، وبشكل خاص من خلال معالجة وإعادة استخدام مياه الصرف الصحي والصناعي بكفاءة. كما يمكنها الاستفادة من التقنيات والأساليب المتطورة في مجال معالجة المياه وتطوير الإدارة السليمة للموارد المائية.",,
"من الآثار السلبية المباشرة لحرائق الغابات القضاء على مساحات واسعة من الغطاء النباتي، مثل الغابات المطيرة التي تستغرق وقتاً طويلاً لتعود إلى طبيعتها، وتتسبب الحرائق أيضاً في نفوق آلاف الحيوانات، وينجو بعضها بالاختباء تحت الأرض أو الهروب إلى مناطق آمنة، وكذلك ينتج عن حرائق الغابات دخان كثيف يؤثر في نقاء الهواء ويضر برئتي الإنسان، فضلاً عن انبعاث كميات هائلة من الميثان وثاني أكسيد الكربون؛ فتزداد درجات حرارة المناخ، وتتأثر مصادر المياه وجودتها ما يؤدي إلى تدمير مواطن الحيوانات.",ما هو تأثير حرائق الغابات على مصادر المياه؟,What is the impact of forest fires on water sources?, ايه تأثير حرائق الغابات على مصادر المياه؟, ايه تأثير حرايق الغابات على مصادر الميه؟,تأثير حرائق الغابات على مصادر المياه يتمثل في تأثيرها على جودة المياه وتدمير مواطن الحيوانات التي تعتمد على هذه المصادر للبقاء.,,
"ويختلف تصميم محطات المعالجة طبقا لنوعية وخصائص مياه الصرف التي ستقوم المحطة بمعالجتها، وتركيز الملوثات التي تختلف من صناعة إلى أخرى، ومن منشأة إلى أخرى ضمن نفس الصناعة، ومن وقت إلى آخر ضمن المصنع الواحد، ولقد كان هذا الاختلاف تحدياً لمهندسي ومطوري تقنيات معالجة المياه؛ ليعتمدوا طرق وتقنيات نوعية المعالجة لمياه الصرف الصناعي، واعتماد هذه الطرق كجزء من الإدارة البيئية داخل المنشآت الصناعية، بالإضافة إلى ضرورة اختيار أنسب الطرق لإدارتها.",ما هي أهمية اختيار أنسب الطرق لإدارة محطات معالجة مياه الصرف؟,What is the significance of selecting the most suitable methods for managing wastewater treatment plants?, ايه اهمية اختيار انسب الطرق لإدارة محطات معالجة مياه الصرف؟,ليه لازم ننقي احسن طريقه إدارة محطات معالجة مية الصرف؟,"أهمية اختيار أنسب الطرق لإدارة محطات معالجة مياه الصرف تكمن في ضمان تحقيق أقصى كفاءة في معالجة المياه وإزالة الملوثات بشكل فعال، مما يساهم في حماية البيئة والحفاظ على جودة المياه وصحة الإنسان. كما يساهم اختيار الطرق الصحيحة في تحسين أداء المحطات وتقليل التكاليف البيئية والاقتصادية المرتبطة بعمليات معالجة المياه.",,
"كذلك لافتة (المصعد معطل) لا تعرف استثناء، فهي ترهق الجميع خصوصا إذا كانت تتعاون مع سلم البناء بدرجاته الراسخة التي يصعب تجاوزها بمرور الأيام، وقد بدأت الصعود بخطوات تبدو سريعة حتى تحولت إلى خطوات ثقيلة وهزيلة ومشتتة، فما لبثت أستعين بأحد الحوائط؛ استجابة لصرخات أنفاسي التي نعتني بأقسي الأوصاف بسبب خطواتي المتثاقلة. فارتكزت إلى الحائط لأجد خلفي أحد أبناء جيراننا المزعجين يتساءل. لماذا أقف هكذا؟ شردت حينها إلى ذكريات فناء منزلنا القديم عندما سألت جدي إبراهيم عن سبب توقفه الدائم والمتكرر أثناء صعوده، فالتفت إلي حينها، وهو متشبث بعكازه وبصوت محشرج قال عندما تكون في مثل عمري ستعرف. لم أجد أعظم من إجابة جدي إبراهيم لأجيبه بها.",ماذا تعني إجابة الجد إبراهيم للكاتب؟,What does Grandfather Ibrahim's answer mean to the writer?, ايه اللي يعنيه لما الجد إبراهيم يرد على الكاتب؟,ايه معنى اجابة الجد إبراهيم بالنسبة للكاتب؟,إجابة الجد إبراهيم للكاتب تعني أن الكاتب سيفهم السبب وراء توقفه الدائم والمتكرر أثناء صعوده عندما يكبر في السن ويصبح في مثل عمر الجد.,,
"حرانق الغابات حرانق هائلة يصعب السيطرة عليها بسهولة، وتندلع في الغابات والأراضي ذات الغطاء النباتي، وقد شهدت الأعوام الأخيرة زيادة في حدتها، ففي عام ٢٠٢١ التهمت النيران ما يقرب من ثمانية ملايين فدان في الولايات المتحدة الأمريكية وحدها. وبالرغم من أن هذه المساحة أقل مما التهمته النيران في عام ٢٠٢٠ والذي تقدر مساحته بما يقارب اثني عشر مليون فدان، فقد زادت صعوبة مكافحة الحرائق عن ذي قبل لسرعة انتشارها.",ماذا حدث لحرائق الغابات في الأعوام الأخيرة؟,What happened to the forest fires in recent years?, ايه اللي حصل مع حرايق الغابات في السنين اللي فاتت؟, ايه اللي حصل مع حرايق الغابات في السنين اللي فاتت؟,شهدت حرائق الغابات زيادة في حدتها في الأعوام الأخيرة.,,
