Retrieved_true,Questions,paraphrases,eg_ar_question (GPT3.5 Turbo),eg_ar_question_edited ,edited_answer (GPT3.5 Turbo),,
"ويتوقف نجاح عمليات معالجة وإعادة استخدام مياه الصرف الصناعي على مجموعة من المعايير والضوابط البيئية التي ترتبط بطبيعة هذه المياه، والهدف النهائي من معالجتها وإعادة استخدامها، والذي يجب أن يجرى في إطار يكفل حماية البيئة والأفراد مع الأخذ في الاعتبار الاعتبارات الاقتصادية وضرورة متابعة الآثار البيئية لإعادة استخدام هذه المياه على مكونات المنظومة البيئية، وذلك من خلال وضع برامج متكاملة للرصد البيئي للملوثات وآثارها على البيئة المحيطة.",كيف يمكن متابعة الآثار البيئية لإعادة استخدام مياه الصرف الصناعي؟,كيف يمكن مراقبة تأثيرات البيئية لإعادة استخدام مياه الصرف الصناعي؟,ازاي ممكن نتابع تأثيرات البيئة لإعادة استخدام مياه الصرف الصناعي؟,ازاي ممكن نتابع تأثيرات البيئة لإعادة استخدام مية الصرف الصناعي؟,يمكن متابعة الآثار البيئية لإعادة استخدام مياه الصرف الصناعي من خلال وضع برامج متكاملة للرصد البيئي للملوثات وآثارها على البيئة المحيطة.,,
"الشمش أو الصواعق الرعدية أو أعواد الثقاب المشتعلة، وأما الوقود فمصدره الأشجار والأوراق الجافة والحشائش. وأما الأكسجين فيعمل على بقاء النار مشتعلة، وتنقل الرياح ألسنة اللهب إلى مناطق مختلفة. توجد أسباب طبيعية تساعد على حدوث حرائق الغابات، منها: الجفاف، وارتفاع درجات الحرارة، والصواعق الرعدية، والحمم البركانية، ولكن تشير الإحصاءات إلى أن الإنسان هو السبب الرئيس وراء اندلاعها؛ فوفقاً لوزارة الداخلية الأمريكية كان 90% من حرائق الغابات بفعل العامل البشري، ويمكن أن يكون لسلوك الإنسان آثار تدميرية إذا قل حرصه في أثناء حرق النفايات، أو إشعال النيران في معسكرات التخييم، أو استخدام الألعاب النارية بالقرب من الغابات والمناطق الخضراء، بالإضافة إلى حوادث السيارات والأعمال التخريبية مثل حرق الأشجار والمنشآت.",ما هي الأسباب الطبيعية التي تساعد على حدوث حرائق الغابات؟,What are the natural causes that contribute to forest fires?, ايه الأسباب الطبيعية اللي بتساعد على حدوث حرائق الغابات؟, ايه الأسباب الطبيعية اللي بتساعد على انه يبقى فيه حرايق غابات؟,"الأسباب الطبيعية التي تساعد على حدوث حرائق الغابات هي الجفاف، وارتفاع درجات الحرارة، والصواعق الرعدية، والحمم البركانية.",,
"من الآثار السلبية المباشرة لحرائق الغابات القضاء على مساحات واسعة من الغطاء النباتي، مثل الغابات المطيرة التي تستغرق وقتاً طويلاً لتعود إلى طبيعتها، وتتسبب الحرائق أيضاً في نفوق آلاف الحيوانات، وينجو بعضها بالاختباء تحت الأرض أو الهروب إلى مناطق آمنة، وكذلك ينتج عن حرائق الغابات دخان كثيف يؤثر في نقاء الهواء ويضر برئتي الإنسان، فضلاً عن انبعاث كميات هائلة من الميثان وثاني أكسيد الكربون؛ فتزداد درجات حرارة المناخ، وتتأثر مصادر المياه وجودتها ما يؤدي إلى تدمير مواطن الحيوانات.",ما هو تأثير دخان حرائق الغابات على الإنسان؟,What is the impact of forest fire smoke on humans?, ايه تأثير دخان حرائق الغابات على الإنسان؟, ايه تأثير دخان حرايق الغابات على الإنسان؟,"تأثير دخان حرائق الغابات على الإنسان يكون من خلال تأثيره على نقاء الهواء وضرره برئتي الإنسان، حيث يمكن أن يسبب مشاكل صحية خطيرة مثل مشاكل التنفس والتهيج العيني والتهاب الجهاز التنفسي.",,
"بدأت في مراقبة الشجرة التي أمام فناء منزلي كأنني أراها للمرة الأولى: فنظرتنا إلى الأشياء تختلف بمرور العمر، لا شيء يتبقى منها إلا خدوش الروح وندبات القلب. في بلوغ الخامسة والخمسين ما كنت ألاحظ تساقط الأوراق التي كانت منذ أيام شديدة النضارة لا يشوبها شيء، لونها أخضر لامع يظهر بقوة مفرطة. لا شيء إلا أيام وتتساقط تلك الأوراق تساقط استسلام ورضوخ للأيام، ما عاد ماء ينفع أو غصن يتمسك بها، فالأيام صبغتها بألوان أخرى، وليس أمامها إلا السقوط كسائر الأشياء. فدورة الأيام لا تعرف الاستثناء.",كيف تختلف نظرتنا إلى الأشياء بمرور العمر؟,How does our perspective on things change as we age?, ازاي بتتغير نظرتنا للحاجات واحنا بنعيش؟, ازاي بتتغير نظرتنا للحاجات كل ما نكبر؟,"تختلف نظرتنا إلى الأشياء بمرور العمر بحيث نبدأ في رؤية الأشياء بمنظور أعمق وأكثر تعقيدًا، ونلاحظ التغيرات والتدهور الذي يحدث مع مرور الوقت. نبدأ في رؤية الجمال والنضارة السابقة تتلاشى وتحل محلها علامات الشيخوخة والتلف. تتغير اهتماماتنا وأولوياتنا وندرك أن كل شيء في النهاية يتلاشى ويسقط كسائر الأشياء.",,
"وقد أصبح ظاهرة يبئية محيرة، فلما انخفضت درجة الحرارة نصف درجة مئوية عن معدلها لمدة قرنين منذ عام ١٥٧٠م مرت أوروبا بعصر جليدى جعل الفلاحين يهجون من أراضيهم ويعانون من المجاعة لقله المحاصيل. وعلى النقيض فلو زادت درجة الحرارة زيادة طفيفة عن متوسطها فستجعل الدفء يطول وفترات الصقيع والبرد تقل؛ مما يجعل النباتات تنمو والمحاصيل تتضاعف والحشرات المعمرة تسعى وتنتشر.",ما هي الظاهرة البيئية المحيرة التي تحدث عنها النص؟,What is the perplexing environmental phenomenon discussed in the text?, ايه الظاهرة البيئية الغريبة اللي بتحصل ومذكورة في النص؟, ايه الظاهرة البيئية الغريبة اللي بتحصل ومذكورة في النص؟,الظاهرة البيئية المحيرة هي العصر الجليدي الذي تعرضت له أوروبا بعد انخفاض درجة الحرارة نصف درجة مئوية عن معدلها لمدة قرنين منذ عام ١٥٧٠م.,,
"تتجمد نحو خمسين مليون بحيرة موسميا، وكان من المعتقد أن الحياة تحت سطوحها الجليدية تتوقف في فصل الشتاء، إلا أن الدراسات التي تجرى على البحار المتجمدة أثبتت أنه على عكس الاعتقادات الماضية، فإن الحياة تحت الثلج مزدهرة ونشطة للغاية، وقد أجريت بعض الدراسات السابقة على حالة البحيرات في الصيف، ولكننا لم نعلم إلا قليلا عما يحدث تحت الغطاء الثلجي في فصل الشتاء، من هنا بدأت (ستيفاني هامبتون) مديرة مركز البحوث البيئية في (جامعة واشنطن) تجميع البيانات الخاصة بحالة البحيرات في الشتاء وتحليلها، وذلك من أجل مقارنتها بحالتها في الصيف.",كيف تؤثر هذه النتائج على البيئة؟,How do these results impact the environment?, ازاي النتايج دي هتأثر على البيئة؟, ازاي النتايج دي هتأثر على البيئة؟,"تؤكد هذه النتائج أن الحياة تحت الثلج في البحيرات مزدهرة ونشطة، مما يعني أن البيئة الشتوية تلعب دوراً هاماً في دورة الحياة في هذه البحيرات. قد تؤدي هذه الاكتشافات إلى فهم أفضل للتأثيرات البيئية للتغيرات المناخية على البحيرات المتجمدة وتحديد الإجراءات الواجب اتخاذها لحماية هذه البيئة الحيوية.",,
"من الآثار السلبية المباشرة لحرائق الغابات القضاء على مساحات واسعة من الغطاء النباتي، مثل الغابات المطيرة التي تستغرق وقتاً طويلاً لتعود إلى طبيعتها، وتتسبب الحرائق أيضاً في نفوق آلاف الحيوانات، وينجو بعضها بالاختباء تحت الأرض أو الهروب إلى مناطق آمنة، وكذلك ينتج عن حرائق الغابات دخان كثيف يؤثر في نقاء الهواء ويضر برئتي الإنسان، فضلاً عن انبعاث كميات هائلة من الميثان وثاني أكسيد الكربون؛ فتزداد درجات حرارة المناخ، وتتأثر مصادر المياه وجودتها ما يؤدي إلى تدمير مواطن الحيوانات.",لماذا تحتاج الغابات المطيرة وقتاً طويلاً لتعود إلى طبيعتها بعد الحرائق؟,Why do rainforests need a long time to return to their natural state after fires?,ليه الغابات المطيرة بتحتاج وقت طويل عشان ترجع لحالتها الطبيعية بعد الحرائق؟,ليه الغابات المطيرة بتحتاج وقت طويل عشان ترجع لحالتها الطبيعية بعد الحرايق؟,تحتاج الغابات المطيرة وقتاً طويلاً لتعود إلى طبيعتها بعد الحرائق لأنها تحتوي على تنوع بيولوجي كبير وأنظمة بيئية معقدة تأخذ وقتاً طويلاً لإعادة بنائها واستعادة التوازن البيئي الذي تضرر نتيجة للحريق.,,
"كذلك لافتة (المصعد معطل) لا تعرف استثناء، فهي ترهق الجميع خصوصا إذا كانت تتعاون مع سلم البناء بدرجاته الراسخة التي يصعب تجاوزها بمرور الأيام، وقد بدأت الصعود بخطوات تبدو سريعة حتى تحولت إلى خطوات ثقيلة وهزيلة ومشتتة، فما لبثت أستعين بأحد الحوائط؛ استجابة لصرخات أنفاسي التي نعتني بأقسي الأوصاف بسبب خطواتي المتثاقلة. فارتكزت إلى الحائط لأجد خلفي أحد أبناء جيراننا المزعجين يتساءل. لماذا أقف هكذا؟ شردت حينها إلى ذكريات فناء منزلنا القديم عندما سألت جدي إبراهيم عن سبب توقفه الدائم والمتكرر أثناء صعوده، فالتفت إلي حينها، وهو متشبث بعكازه وبصوت محشرج قال عندما تكون في مثل عمري ستعرف. لم أجد أعظم من إجابة جدي إبراهيم لأجيبه بها.",ماذا قال جد الكاتب عندما سأله عن سبب توقفه أثناء الصعود؟,What did the writer's grandfather say when asked about the reason for his pause during the ascent?, ايه اللي قاله جد الكاتب لما سأله عن سبب توقفه وهو بيصعد؟, ايه اللي قاله جد الكاتب لما سأله عن سبب وقوفه وهو طالع؟,"أجاب جد الكاتب بأنه قال ""عندما تكون في مثل عمري ستعرف""",,
"الشمش أو الصواعق الرعدية أو أعواد الثقاب المشتعلة، وأما الوقود فمصدره الأشجار والأوراق الجافة والحشائش. وأما الأكسجين فيعمل على بقاء النار مشتعلة، وتنقل الرياح ألسنة اللهب إلى مناطق مختلفة. توجد أسباب طبيعية تساعد على حدوث حرائق الغابات، منها: الجفاف، وارتفاع درجات الحرارة، والصواعق الرعدية، والحمم البركانية، ولكن تشير الإحصاءات إلى أن الإنسان هو السبب الرئيس وراء اندلاعها؛ فوفقاً لوزارة الداخلية الأمريكية كان 90% من حرائق الغابات بفعل العامل البشري، ويمكن أن يكون لسلوك الإنسان آثار تدميرية إذا قل حرصه في أثناء حرق النفايات، أو إشعال النيران في معسكرات التخييم، أو استخدام الألعاب النارية بالقرب من الغابات والمناطق الخضراء، بالإضافة إلى حوادث السيارات والأعمال التخريبية مثل حرق الأشجار والمنشآت.",ما هي الأثار التي يمكن أن تسببها حوادث السيارات والأعمال التخريبية في الغابات؟,What are the effects that car accidents and acts of vandalism can cause in forests?, ايه الأثار اللي ممكن تحصل من حوادث العربيات والتخريب في الغابات؟, ايه  اللي ممكن يحصل نتيجه حوادث العربيات والتخريب في الغابات؟,"الأثار التي يمكن أن تسببها حوادث السيارات والأعمال التخريبية في الغابات تشمل حرق الأشجار والمنشآت، وبالتالي تدمير النباتات والحيوانات وتقليل التنوع البيولوجي في البيئة الغابية.",,
"وقد أصبح ظاهرة يبئية محيرة، فلما انخفضت درجة الحرارة نصف درجة مئوية عن معدلها لمدة قرنين منذ عام ١٥٧٠م مرت أوروبا بعصر جليدى جعل الفلاحين يهجون من أراضيهم ويعانون من المجاعة لقله المحاصيل. وعلى النقيض فلو زادت درجة الحرارة زيادة طفيفة عن متوسطها فستجعل الدفء يطول وفترات الصقيع والبرد تقل؛ مما يجعل النباتات تنمو والمحاصيل تتضاعف والحشرات المعمرة تسعى وتنتشر.",ماذا حدث في أوروبا عندما انخفضت درجة الحرارة نصف درجة مئوية عن معدلها لمدة قرنين منذ عام 1570م؟,What happened in Europe when the temperature dropped half a degree Celsius below its average for two centuries since 1570 AD?, ايه اللي حصل في اوروبا لما نزلت درجة الحرارة نص درجة عن المعدل لمدة عشرين سنة من سنة 1570؟, ايه اللي حصل في اوروبا لما نزلت درجة الحرارة نص درجة عن المعدل الطبيعي لمدة عشرين سنة من سنة 1570؟,"عندما انخفضت درجة الحرارة نصف درجة مئوية عن معدلها لمدة قرنين منذ عام 1570م، مرت أوروبا بعصر جليدي جعل الفلاحين يهجرون من أراضيهم ويعانون من المجاعة لقلة المحاصيل.",,
"ويختلف تصميم محطات المعالجة طبقا لنوعية وخصائص مياه الصرف التي ستقوم المحطة بمعالجتها، وتركيز الملوثات التي تختلف من صناعة إلى أخرى، ومن منشأة إلى أخرى ضمن نفس الصناعة، ومن وقت إلى آخر ضمن المصنع الواحد، ولقد كان هذا الاختلاف تحدياً لمهندسي ومطوري تقنيات معالجة المياه؛ ليعتمدوا طرق وتقنيات نوعية المعالجة لمياه الصرف الصناعي، واعتماد هذه الطرق كجزء من الإدارة البيئية داخل المنشآت الصناعية، بالإضافة إلى ضرورة اختيار أنسب الطرق لإدارتها.",على ماذا يعتمد تصميم محطات معالجة مياه الصرف؟,Paraphrased question: ما هي العوامل التي يعتمد عليها تصميم محطات معالجة مياه الصرف؟,على إيه بيعتمد تصميم محطات معالجة مياه الصرف؟,هو تصميم محطات معالجة مية الصرف  بيعتمد على إيه؟,"يعتمد تصميم محطات معالجة مياه الصرف على نوعية وخصائص مياه الصرف التي ستتم معالجتها، وتركيز الملوثات التي تختلف من صناعة إلى أخرى، ومن منشأة إلى أخرى ضمن نفس الصناعة، ومن وقت إلى آخر ضمن المصنع الواحد.",,
"تتجمد نحو خمسين مليون بحيرة موسميا، وكان من المعتقد أن الحياة تحت سطوحها الجليدية تتوقف في فصل الشتاء، إلا أن الدراسات التي تجرى على البحار المتجمدة أثبتت أنه على عكس الاعتقادات الماضية، فإن الحياة تحت الثلج مزدهرة ونشطة للغاية، وقد أجريت بعض الدراسات السابقة على حالة البحيرات في الصيف، ولكننا لم نعلم إلا قليلا عما يحدث تحت الغطاء الثلجي في فصل الشتاء، من هنا بدأت (ستيفاني هامبتون) مديرة مركز البحوث البيئية في (جامعة واشنطن) تجميع البيانات الخاصة بحالة البحيرات في الشتاء وتحليلها، وذلك من أجل مقارنتها بحالتها في الصيف.",ماذا بدأت (ستيفاني هامبتون) مديرة مركز البحوث البيئية في (جامعة واشنطن)؟,Paraphrased question: ما هو الدور الذي بدأته (ستيفاني هامبتون) كمديرة لمركز البحوث البيئية في (جامعة واشنطن)؟,"Transliteration: Stefani Hampton, manager of the Environmental Research Center at Washington University, began what?

 ايه اللي استاذة ستيفاني هامبتون مديرة مركز البحوث البيئية في جامعة واشنطن بدأت فيه؟",(ستيفاني هامبتون) مديرة مركز البحوث البيئية في (جامعة واشنطن ابتديت ايه؟,"بدأت (ستيفاني هامبتون) مديرة مركز البحوث البيئية في (جامعة واشنطن) تجميع البيانات الخاصة بحالة البحيرات في الشتاء وتحليلها، وذلك من أجل مقارنتها بحالتها في الصيف.",,
"تتجمد نحو خمسين مليون بحيرة موسميا، وكان من المعتقد أن الحياة تحت سطوحها الجليدية تتوقف في فصل الشتاء، إلا أن الدراسات التي تجرى على البحار المتجمدة أثبتت أنه على عكس الاعتقادات الماضية، فإن الحياة تحت الثلج مزدهرة ونشطة للغاية، وقد أجريت بعض الدراسات السابقة على حالة البحيرات في الصيف، ولكننا لم نعلم إلا قليلا عما يحدث تحت الغطاء الثلجي في فصل الشتاء، من هنا بدأت (ستيفاني هامبتون) مديرة مركز البحوث البيئية في (جامعة واشنطن) تجميع البيانات الخاصة بحالة البحيرات في الشتاء وتحليلها، وذلك من أجل مقارنتها بحالتها في الصيف.",ماذا كان يعتقد عن الحياة تحت سطوح البحيرات الجليدية في فصل الشتاء؟,What did he believe about life under the surfaces of the ice lakes in winter?, ايه اللي كان بيفكر فيه عن الحياة تحت سطوح البحيرات الجليدية في فصل الشتاء؟, ايه اللي كان بيفكر فيه عن الحياة تحت  البحيرات الجليدية في فصل الشتا؟,كان من المعتقد أن الحياة تحت سطوح البحيرات الجليدية تتوقف في فصل الشتاء.,,
"من باب الصمت أن تختار لجلوسك مكانا مستورا تخلو فيه إلى نفسك، أو إلى من تتحدث إليه من الأصدقاء فيكون لك بهذا التخفى وجود واضح بارز ومن باب الجلبة والصياح أن تجلس مكشوفا على طوار الشارع فى المقهى، حيث تصبح جزءا من بضائع الدكاكين وحركة المرور، ومن الصمت أن تختار لملابسك وأثاث منزلك ألوانا خافتة هادئة يرتاح إليها البصر، كما أن من الجلبة والصياح أن تختار هذه الأشياء من ذوات الألوان الزاعقة التى تلفت الأنظار، ومن الصمت أن تعلن عن عيادتك، أو مكتبك، أو دكانك بلافتة صغيرة متواضعة، كما أن من الجلبة والصياح أن تعلن عن نفسك بلافتة عريضة تسد على الناس مسالك الطريق، واذكر أن ارتفاع الصوت قد يدل على تفاهة الصائت فالكلب الذى ينبح لا يعض وكلما ازدادت الشاة صياحا قل على ظهرها الصوف، والضفدعة الهزيلة الضئيلة تملأ الآفاق ضجة ونقيقا. يستحيل أن تكون من الصاخبين ومن العاملين فى وقت واحد، ويستحيل أن تكون من الصائحين ومن الفكرين فى وقت واحد، فقد يتعذر أن يجتمع الكلام والعمل لأن الفكرة إذا طافت برأسك فصحت بها كلاما انتهى بذلك أمرها؛ أما إذا حبستها فى نفسك، وأغلقت دونها صدرك بمغاليق الصمت، فقد تتفجر فى صورة عمل عاجلا أو آجلا.",كيف يتمثل الجلبة والصياح في اختيار ألوان الملابس وأثاث المنزل؟,How do chaos and noise manifest in choosing the colors of clothes and home furniture?, ازاي بنختار الوان الملابس واثاث المنزل بطريقة تبان فيها الجلبة والصياح؟, ازاي الدوشه بتأثر في تنقيه الوان اللبس والموبيليا؟,"يتمثل الجلبة والصياح في اختيار ألوان الملابس وأثاث المنزل من خلال اختيار الألوان الزاهية والزاعقة التي تلفت الأنظار وتجذب الانتباه، بينما يتمثل الصمت في اختيار الألوان الخافتة والهادئة التي ترتاح لها البصر وتعكس الهدوء والانسجام.",,
